,name,image,description,prep_time,cook_time,total_time,servings_number,servings_unit,course,cuisine,diet,ingredients,instructions,nutrition
40,Phirni Recipe | Firni,https://www.vegrecipesofindia.com/wp-content/uploads/2021/08/phirni-recipe-2-280x280.jpg,"Phirni is a classic creamy slow-cooked sweet pudding made with ground rice, sugar, milk, almonds, saffron and cardamom powder. It is a popular North Indian sweet made during festive occasions.",5minutes,25minutes,30minutes,4,,"Desserts, Sweets","North Indian, Punjabi","Gluten Free, Vegetarian","▢ ¼ cup basmati rice▢ 1 litre whole milk or organic milk▢ ½  cup sugar or as required▢ 10 to 12 almonds – blanched and peeled, reserve a few for garnishing▢ 10 to 12 pistachios – blanched and peeled, reserve a few for garnishing▢ ½  teaspoon cardamom powder or 6 to 7 green cardamoms, crushed and powdered in a mortar-pestle▢ 12 to 15 saffron strands▢ 2 teaspoon rose water or pandanus water (kewra water)","Grinding riceRinse the rice a couple of times in water. Drain the water and let them dry on their own by spreading them on a tray or plate. Or wipe the grains dry with a kitchen towel.Take the dried rice grains in a dry grinder or coffee grinder. Grind the rice till the consistency resembles sooji (rava or fine semolina) or corn meal or couscous .Alternatively, soak the rice in water for 30 minutes and then drain the water. Dry the rice grains naturally and later grind to a semi fine powder.Set the ground rice aside.Blanching almonds and pistachiosTake hot boiling water in a small bowl. Add the nuts and cover the bowl.Blanch for 30 minutes. Drain the water.When the almonds and pistachios become warm, then peel and later slice or chop them.Reserve a few almond and pistachio slices for garnish.Making phirni Heat milk in a thick bottomed broad pan or sauce pan or kadai.When the milk becomes warm, take 1 tablespoon from it in a small bowl.Stir the saffron strands in this warm milk and keep aside.Let the milk reach to a boil. Then lower the heat and add the ground rice. Stir and add sugar also.On a low to medium heat cook the ground rice in the milk. Do not cover the pan.Keep on stirring at intervals so that the lumps are not formed.Also powder the cardamoms in a mortar-pestle. Discard the cardamom peels.When the rice is almost cooked, add the almonds, pistachios, cardamom powder and saffron infused milk.Stir and cook for a further 5 to 6 minutes or more or till the firni thickens and the rice granules are softened and cooked completely.Lastly add rose water, once the firni is done.Pour the phirni in serving bowls. Garnish it with the remaining chopped almond and pistachio slices.Cover the bowls tightly with lid or secure firmly with aluminium foil. Once cooled at room temperature, refrigerate phirni for about 4 hours or more.Serve phirni once cooled.Store it in the refrigerator for 2 to 3 days and in the freezer, for about 1 week.",NutritionCalories: 172kcal | Carbohydrates: 36g | Protein: 2g | Fat: 3g | Saturated Fat: 1g | Polyunsaturated Fat: 1g | Monounsaturated Fat: 1g | Cholesterol: 1mg | Sodium: 2mg | Potassium: 68mg | Fiber: 1g | Sugar: 25g | Vitamin A: 8IU | Vitamin B1 (Thiamine): 1mg | Vitamin B2 (Riboflavin): 1mg | Vitamin B3 (Niacin): 1mg | Vitamin B6: 1mg | Vitamin C: 1mg | Vitamin D: 1µg | Vitamin E: 1mg | Vitamin K: 1µg | Calcium: 16mg | Vitamin B9 (Folate): 4µg | Iron: 1mg | Magnesium: 14mg | Phosphorus: 38mg | Zinc: 1mg
41,Mughlai Biryani,https://www.vegrecipesofindia.com/wp-content/uploads/2015/12/mughlai-veg-biryani-recipe-1-280x280.jpg,"This veg Mughlai biryani is a mild, lightly spiced, dum cooked & layered biryani made with rice, spices, mixed veggies and dry fruits.",45minutes,25minutes,1hour,4,,Main Course,"Awadhi, Mughlai, North Indian",,for cooking rice▢ 1.5 cups basmati rice or 300 grams basmati rice▢ 1 inch cinnamon▢ 1 medium tej patta (indian bay leaf or tamalpatra)▢ 2 to 3 single strands of mace▢ 3 cloves▢ 3 green cardamoms▢ 5 cups water for cooking rice▢ ½ teaspoon salt or add as required,"preparationPick and rinse basmati rice in running water till the water runs clear of starch. Soak the rice in enough water for 30 minutes. After 30 minutes drain the rice and keep aside.Soak 10 to 12 almonds and 1 tbsp melon seeds/magaz in 1/3 cup hot water for 30 minutes.Later drain the almonds and melon seeds and add them to small grinder jar. Also add 1 tbsp desiccated coconutAdd 2 tbsp water and grind to a smooth paste. Keep this white paste aside.When the rice and almonds + melon seeds are soaking prep the other ingredients. Rinse, peel and chop all the veggies.Slice 1 large onion thinly (about 1 heaped cup thinly sliced onion).Crush 1 inch ginger and 7 to 8 medium garlic cloves to a paste in mortar-pestle. Gives about 1 tbsp ginger-garlic paste.Chop a few mint leaves. About 2 tbsp chopped mint leaves.cooking riceTake a deep bottomed pan. Add 5 cups water and bring the water to a boil on a high flame.Add whole spices – 1 inch cinnamon, 1 medium tej patta, 2 to 3 single strands of mace, 3 cloves and 3 green cardamoms.Now add the rice and add 1/2 tsp salt or add as required.Keep the flame on high and cook the rice.The rice has to be 75% or ¾th cooked. The grains should have a slight bite to them when cooked. The rice should not be fully cooked but almost cooked.Next strain the rice in a colander. You can also rinse the rice gently with water so that the grains stop cooking. Keep aside.making vegetable gravy for mughlai biryaniIn a pressure cooker, heat 3 to 4 tbsp ghee.Add 10 to 12 almonds. Fry them till they get golden. Remove and keep aside in a plate.Next add 15 to 16 raisins. Fry the raisins till they swell and become plump. Remove and keep aside.Then add 10 to 12 cashews and fry them till the cashews turn golden. Remove and keep aside.Now add the thinly sliced onions. Begin to stir and sauté them on a low to medium flame. Onions take time to cook, so add a pinch of salt to quicken the cooking process.Sauté the onions till they turn golden and caramelize.Switch off the flame. Keep the cooker down. Quickly remove 1/2 of the fried onions from the pressure cooker and keep aside.Keep the cooker back again on the stove top. Add whole spices – 1 medium sized tej patta, 3 cloves, 1 inch cinnamon, 2 single strands of mace, 3 green cardamoms, 1 black cardamom, 8 to 9 black pepper and 1 tsp shah jeera. (keep all the spices ready in a plate, so that the onions do not burn. Add all in one go. If you remove the jars, add one by one, the onions will get burnt by then. )Next add ginger-garlic paste. Stir and saute for a few seconds.Add the mixed veggies and 1/2 tsp kashmiri red chili powder. Sauté for 2 to 3 minutes.Add the ground white paste, 1/2 cup fresh curd/yogurt and 2/3 cup water.Mix and stir very well.Season with salt. Stir well and pressure cook the vegetable gravy for 8 to 9 minutes or 1 to 2 whistles.When the pressure settles down on its own, check the gravy. If the gravy looks thin, then do simmer till it becomes slightly thick.Add 1/2 tsp garam masala powder or biryani masala powder to the gravy. Mix well.assembling and layering mughlai biryaniWhen the veggies are pressure cooking, soak 1/4 tsp saffron strands in 3 tbsp warm milk.Grease an heat proof oven safe bowl with some ghee or butter.Pour a first layer of half of the vegetable gravy.Add some paneer cubes.Layer with the rice. Also sprinkle some of the saffron soaked milk on the rice.Now add half of the fried dry fruits, fried onions and half of the chopped mint leaves evenly all over.Layer with the remaining vegetable gravy. Also top with the remaining paneer cubes.Layer with half of the rice. Also sprinkle some of the saffron soaked milk on the rice.Repeat the rice layer, fried dry fruits, fried onions, mint leaves and saffron milk. Also sprinkle evenly 2 tsp rose water or kewra water (optional).cooking mughlai biryani Seal tightly with an aluminum foil.Place the bowl in a preheated oven and bake veg biryani at 200 degrees celsius for 20 to 25 minutes. Once the baking is done, remove the bowl from the oven and give a resting time of 5 minutes before you serve the biryani.Serve mughlai biryani with onion tomato raita.",NutritionCalories: 696kcal | Carbohydrates: 89g | Protein: 20g | Fat: 31g | Saturated Fat: 15g | Polyunsaturated Fat: 3g | Monounsaturated Fat: 7g | Trans Fat: 1g | Cholesterol: 59mg | Sodium: 696mg | Potassium: 653mg | Fiber: 10g | Sugar: 7g | Vitamin A: 6116IU | Vitamin B1 (Thiamine): 1mg | Vitamin B2 (Riboflavin): 1mg | Vitamin B3 (Niacin): 3mg | Vitamin B6: 1mg | Vitamin B12: 1µg | Vitamin C: 21mg | Vitamin D: 1µg | Vitamin E: 2mg | Vitamin K: 6µg | Calcium: 355mg | Vitamin B9 (Folate): 64µg | Iron: 4mg | Magnesium: 122mg | Phosphorus: 317mg | Zinc: 3mg
42,Curd Rice Recipe | Daddojanam | Thayir Sadam,https://www.vegrecipesofindia.com/wp-content/uploads/2016/07/curd-rice-2-280x280.jpg,"Curd Rice also called Thayir Sadam or Daddojanam is a popular and traditional South Indian preparation where cooked rice is mixed with curd (yogurt) and tempered with spices, herbs. It is a staple in many South Indian households and is also made during Hindu festivals.",15minutes,5minutes,20minutes,3,,"Main Course, Side Dish","South Indian, Tamil Nadu",Vegetarian,"For cooking rice▢ ½ cup rice – 100 grams, any short grained to medium-grained rice▢ 1.5 cups water – for pressure cooking","Cooking riceRinse the rice grains a couple of times in water. Then add the rice in a 2-litre stovetop pressure cooker.Add 1.5 cups water. Stir and mix very well.Pressure cook rice on medium heat for 5 to 6 whistles or 8 to 9 minutes till the rice is cooked and softened very well.When the pressure settles down on its own, remove the lid and check the doneness of rice. The rice has to be more softer than what we cook on a daily basis and look mushy.With a spoon or vegetable masher, mash the rice. Close the cooker and allow the rice to become lukewarm or come at room temperature.Making curd riceWhen the rice becomes comes at room temperature and has completely cooled, add fresh curd and milk. Mix again very well and break lumps if any. You can either use the spoon or masher while breaking the lumps.Add finely chopped ginger, finely chopped curry leaves, chopped green chilies and chopped coriander leaves. Instead of adding ginger and curry leaves to the rice, you can also fry them in the tempering.Add salt. Mix very well. Keep aside.TemperingHeat a small pan or tadka pan and add sesame oil in it. You can use peanut oil or sunflower oil instead of sesame oil. When the oil becomes hot, lower the heat. Add mustard seeds.Let the mustard seeds crackle. Then add urad dal. Urad dal is optional and can be skipped. Fry on a low heat stirring often till the urad dal becomes golden. Lastly add the add curry leaves and asafoetida. Mix very well. Switch off the heat and immediately pour the tempering in the curd rice mixture. Again mix very well.Serve Curd Rice topped with a few coriander leaves or pomegranate arils or grapes. You can skip the fruits too and just serve curd rice as is. You can also serve with fried sun dried green chillies or any South Indian mango pickle.Store any leftovers in the refrigerator for some hours. Better to eat on the same day. ",NutritionCalories: 223kcal | Carbohydrates: 31g | Protein: 10g | Fat: 6g | Saturated Fat: 1g | Polyunsaturated Fat: 2g | Monounsaturated Fat: 2g | Trans Fat: 0.003g | Cholesterol: 6mg | Sodium: 90mg | Potassium: 180mg | Fiber: 2g | Sugar: 4g | Vitamin A: 241IU | Vitamin B1 (Thiamine): 0.1mg | Vitamin B2 (Riboflavin): 0.2mg | Vitamin B3 (Niacin): 58mg | Vitamin B6: 0.1mg | Vitamin B12: 1µg | Vitamin C: 102mg | Vitamin D: 0.2µg | Vitamin E: 0.2mg | Vitamin K: 2µg | Calcium: 135mg | Vitamin B9 (Folate): 592µg | Iron: 0.5mg | Magnesium: 23mg | Phosphorus: 154mg | Zinc: 1mg
43,Masale Bhat Recipe | Maharashtrian Masala Bhat,https://www.vegrecipesofindia.com/wp-content/uploads/2014/05/masale-bhaat-recipe-1-280x280.jpg,"Masala bhat is a tasty, spicy and aromatic one-pot traditional rice recipe made with various mix vegetables, spices, herbs, nuts and coconut from the Maharashtrian cuisine.",30minutes,35minutes,1hour,3,to 4,Main Course,"Indian, Maharashtrian",Vegetarian,main ingredients▢ 1 cup regular rice or long grained rice▢ 1 cup chopped cauliflower▢ 1 small carrot▢ 2 small brinjals (aubergines or baingan)▢ 1 small to medium capsicum (green bell pepper▢ 1 small potato (optional)▢ 1 small to medium tomato or 2 tablespoon yogurt (curd)▢ 1 tej patta (indian bay leaf) or 7 to 8 curry leaves ▢ 3 to 4 teaspoon Goda Masala (kala masala) – (recipe for a small batch given in the notes section)▢ ½ teaspoon Kashmiri Chilli Powder▢ 1 teaspoon mustard seeds▢ 1 pinch asafoetida (hing)▢ 2.5 cups water or as required▢ 2 tablespoon oil▢ salt as required,"Rinse and soak the rice for 30 minutes in enough water.Rinse and chop all the veggies.making masale bhatHeat oil in pan. add the mustard seeds and bay leaf or curry leaves.Let the mustard seeds crackle.Then add the all the chopped veggies – carrots, cauliflower, capsicum, aubergines and tomatoes or yogurt.Saute the veggies for 3 to 4 minutes stirring often.Meanwhile heat 2.5 cups water and bring it to a boil.Add the red chili powder, goda masala, asafoetida to the sauteed veggies. Stir and saute for a minute.Then add the rice and saute for a minute.Add the hot water and stir well.Season with salt. check the taste of the water. If required add more salt.Cover the pan and simmer the rice on a low flame till the grains are softened and cooked well.Do check once or twice when the rice is cooking, by opening the lid.If the water looks less and the rice uncooked, add some more hot water and continue cooking the rice. Stir gently with a fork.While the rice is cooking, roast the cashews till golden in a pan.Once the rice is cooked, let the rice stand for 5 minutes in the pan.Then sprinkle ghee on top of the masale bhat.serving masala bhatWhen serving garnish with coconut, cashews and chopped coriander leaves.You can also sprinkle a few dots of ghee on the served rice instead of adding it in the pan.Serve the masala bhat hot accompanied with yogurt, buttermilk, raita or a side maharashtrian vegetable dish or khamang kakdi.",
44,Chana Dal Khichdi,https://www.vegrecipesofindia.com/wp-content/uploads/2013/06/chana-dal-khichdi-1a-280x280.jpg,"This is a simple and flavorful traditional Punjabi chana dal khichdi made with basmati rice, bengal gram and spices.",30minutes,20minutes,50minutes,2,,Main Course,"North Indian, Punjabi",Vegan,▢ ½ cup basmati rice or broken basmati or regular rice▢ ½ cup chana dal (spilt-skinned bengal gram)▢ 1 pinch asafoetida (hing)▢ 1 to 2 pinch Red Chili Powder▢ 1 cup water▢ 1 tablespoon oil▢ salt as required,"Soaking chana dalFirst rinse chana dal in fresh water a couple of times. Then soak the chana dal overnight at room temperature or for 4 to 5 hours or soak for 30 minutes in hot water. Also rinse and soak the rice for 30 minutes. Later, strain the chana dal of the water and keep aside.Cooking chana dalHeat oil in the stovetop pressure cooker. Lower the heat. Add the red chili powder, asafoetida and salt as required.Stir and fry for a few seconds. Add the chana dal. Stir and then add 1 cup water.Cover the pressure cooker with its lid and pressure cook for 1 or 2 whistles or for about 6 minutes. Once the pressure settles down on its own, then only open the lid of the cooker.The dal should be cooked and also should be separate.You can also cook the dal for 1 whistle and then check. If not cooked then cook for 1 more whistle. Remember the dal should not be mushy.Making chana dal khichdiDrain all the water from the rice and add the rice to the cooked dal in the pressure cooker.There will be water in the cooker along with the cooked dal, so no need to add extra water.Stir and again pressure cook for 1 or 2 whistles. The dal would cook further more along with the rice.Once the pressure settles down on its own, then only remove the lid.The specialty of this khichdi is the separate grains of rice and dal and it is not mushy nor pasty. If the rice is not cooked, then you can add about ⅛ to ¼ cup water and pressure cook again for a whistle or two.Serve the punjabi chana dal khichdi steaming hot with yogurt or raita variety like onion raita or onion tomato raita. You can also serve lemon pickle or mango pickle with it.This khichdi tastes best when it is eaten hot. It does not taste so good when it cools down. That's why I won't suggest to pack it for lunch box or tiffin box as this khichdi becomes dry as it cools.",NutritionCalories: 381kcal | Carbohydrates: 65g | Protein: 10g | Fat: 9g | Saturated Fat: 1g | Polyunsaturated Fat: 1g | Monounsaturated Fat: 6g | Sodium: 592mg | Potassium: 57mg | Fiber: 12g | Sugar: 1g | Vitamin A: 37IU | Vitamin B1 (Thiamine): 1mg | Vitamin B2 (Riboflavin): 1mg | Vitamin B3 (Niacin): 1mg | Vitamin B6: 1mg | Vitamin C: 1mg | Vitamin E: 3mg | Vitamin K: 1µg | Calcium: 98mg | Vitamin B9 (Folate): 4µg | Iron: 2mg | Magnesium: 13mg | Phosphorus: 54mg | Zinc: 1mg
45,Palak Khichdi Recipe (Spinach Khichdi),https://www.vegrecipesofindia.com/wp-content/uploads/2014/01/palak-khichdi-recipe-1-280x280.jpg,"Palak Khichdi is a one pot nutritious meal of mung lentils and rice cooked with spinach (palak), onions, tomatoes, peanuts, herbs and spices. It makes for a comforting delicious meal for lunch or dinner.",30minutes,10minutes,40minutes,3,,Main Course,Indian,Vegetarian,"▢ 2 cups chopped palak (spinach)▢ ¼ or ⅓ cup raw peanuts▢ ½ cup moong dal (yellow mung lentils)▢ ½ cup long grained rice or basmati rice▢ 1 medium size onion, finely chopped▢ 1 medium size tomato, chopped▢ 1 medium size potato, chopped▢ 1 inch cinnamon▢ 1 tej patta (indian bay leaf)▢ 2 cloves▢ 2 green cardamoms▢ ½ teaspoon caraway seeds (shah jeera) or cumin seeds▢ ½ inch ginger + 3 to 4 garlic – crushed in a mortar-pestle to a paste or 1 teaspoon ginger garlic paste▢ 1 green chilli, chopped▢ ¼ teaspoon turmeric powder▢ 1 pinch asafoetida (hing) * check notes▢ salt as required▢ 2 tablespoon Ghee or oil▢ 3.5 to 4 cups water","PreparationPick and rinse both the rice and moong dal together with water in a strainer or colander. Soak them together in enough water for about 30 minutes in a bowl.Rinse the palak or spinach leaves well. Drain all the water.Chop them and then in a mixer or blender, make a smooth puree of the spinach adding very little water. Keep the spinach puree aside. You need about 2 cups of chopped spinach to make the puree.Sautéing IngredientsHeat ghee or oil in a 3 litre stovetop pressure cooker. Add the caraway seeds or cumin seeds, cinnamon, tej patta, cloves and cardamoms.Fry the whole spices on low to medium low heat for some seconds till they become fragrant. Add the finely chopped onion and saute stirring often till they become golden.Add the ginger-garlic paste and the chopped green chilies. Saute for some seconds or till the raw aroma of the ginger-garlic goes away.Then add the chopped tomatoes and saute stirring often till they begin to soften.Add the turmeric powder and asafoetida (hing) and stir well.Now add the peanuts, potatoes and saute for about 2 minutes. You can choose to skip adding the potatoes.Add the spinach puree and continue to saute for 2 to 3 minutes on low to medium low heat.Drain the water from the rice and moong dal and add them to the spinach mixture in the pressure cooker. Mix very well.Making Palak KhichdiPour 3.5 to 4 cups water. Add salt as required and stir to mix.Check the taste and if required add some more salt. Pressure cook the khichdi on medium heat for 5 to 6 whistles.Once the pressure settles down on its own in the cooker, then only remove the lid. Check the consistency of the palak khichdi.If the consistency looks thick, then you can add some hot water and simmer for a few minutes.Remember to stir often as otherwise the khichdi gets stuck at the bottom. If the consistency appears thin or runny, then simmer stirring often till you get the desired consistency.While serving, pour the palak khichdi in bowls or plates and top with ½ to 1 tsp of ghee.Serve hot with plain curd/yogurt or raita or a simple vegetable salad or roasted papad.",NutritionCalories: 429kcal | Carbohydrates: 56g | Protein: 16g | Fat: 17g | Saturated Fat: 7g | Polyunsaturated Fat: 3g | Monounsaturated Fat: 6g | Cholesterol: 26mg | Sodium: 486mg | Potassium: 416mg | Fiber: 8g | Sugar: 4g | Vitamin A: 2289IU | Vitamin B1 (Thiamine): 1mg | Vitamin B2 (Riboflavin): 1mg | Vitamin B3 (Niacin): 3mg | Vitamin B6: 1mg | Vitamin C: 16mg | Vitamin E: 1mg | Vitamin K: 100µg | Calcium: 88mg | Vitamin B9 (Folate): 84µg | Iron: 3mg | Magnesium: 62mg | Phosphorus: 118mg | Zinc: 1mg
46,Rajma Pulao (Kidney Beans Pilaf),https://www.vegrecipesofindia.com/wp-content/uploads/2018/11/rajma-pulao-recipe-1-280x280.jpg,"Rajma Pulao is a fragrant and spiced Kidney Beans Pilaf made with cooked kidney beans, basmati rice, onions, herbs and spices in a stovetop pressure cooker. The dried kidney beans are soaked for 8 to 9 hours in water and later pressure cooked until softened and tender. The boiled kidney beans are further cooked with a flavorful mix of various spices, herbs, onions and basmati rice to make this delicious pilaf.",9hours,35minutes,9hours,2,,Main Course,North Indian,"Vegan, Vegetarian",for cooking rajma▢ ½ cup rajma (kidney beans) or 90 to 100 grams rajma▢ 2 cups water for pressure cooking▢ ¼ teaspoon salt (optional),"Cooking rajmaA night before or for 8 to 9 hours, rinse ½ cup rajma a couple of times and then soak in water.The next day, discard the soaked water. Then rinse the rajma beans again very well in running water. Drain the water again.Add the rinsed rajma to a 2 litre stovetop pressure cooker along with 2 cups of water. You can also add ¼ teaspoon salt if you want.Pressure cook for 15 to 20 whistles or for 12 to 17 minutes. First I cooked rajma beans for 15 whistles and found that the beans were still uncooked from the center. So I pressure cooked for 5 whistles more. Rajma has to be cooked very well. There should be no rawness or bite in the rajma. Pressure cooking time will vary depending on quality of rajma.When the pressure settles down on its own in the cooker, then only remove the lid. Strain the rajma. Keep aside.Soaking riceBefore you keep the rajma for cooking, rinse 1 heaped cup basmati rice very well in water till the water runs clear of starch. Then soak the rice in enough water for 20 to 30 minutes. After 20 to 30 minutes strain the rice of all the water and keep aside.Preparing ginger+garlic+green chili pasteIn a mortar-pestle take roughly chopped ginger, roughly chopped garlic cloves and chopped green chilies.Crush to a coarse paste. You can also use a small grinder to make this paste. Keep aside.Thinly slice one medium onion. Also chop coriander leaves and keep aside.Sautéing spices and onionsJust rinse the same stovetop pressure cooker in which we cooked rajma beans, with water and then keep again on stove top. Add oil. When the oil becomes hot, lower the heat and add these whole spices – tej patta, cloves, green cardamoms, black cardamom, cinnamon and cumin seeds.Let the spices crackle.Now add thinly sliced onions. On a low to medium heat, begin sauteing the onions. Saute the onions stirring often till they start to become golden.Now add the crushed ginger+garlic+green chilli paste along with chopped coriander leaves.Stir and saute till the raw aroma of ginger-garlic goes away. This takes a few seconds.Add the cooked rajma beans.Next add turmeric powder, red chili powder and coriander powder. Stir and mix well.Add the soaked rice. Season with salt as required.Gently stir and mix the rice and salt with the rest of the ingredients.Making rajma pulaoNow add 2 cups water. You can add 1.75 cups to 2 cups of water. Do add water depending on the quality of basmati rice.Lastly add lemon juice and stir again.Cover and pressure cook the pulao on a medium to high heat for 2 to 3 whistles or 8 to 9 minutes.When the pressure comes down on its own, then only open the lid and gently fluff the pulao.Garnish with some chopped coriander leaves and serve rajma pulao hot with your favorite raita or salad or pickle.",NutritionCalories: 741kcal | Carbohydrates: 116g | Protein: 19g | Fat: 23g | Saturated Fat: 2g | Polyunsaturated Fat: 1g | Monounsaturated Fat: 18g | Sodium: 1144mg | Potassium: 905mg | Fiber: 13g | Sugar: 5g | Vitamin A: 310IU | Vitamin B1 (Thiamine): 1mg | Vitamin B2 (Riboflavin): 1mg | Vitamin B3 (Niacin): 3mg | Vitamin B6: 1mg | Vitamin C: 17mg | Vitamin E: 9mg | Vitamin K: 12µg | Calcium: 127mg | Vitamin B9 (Folate): 197µg | Iron: 5mg | Magnesium: 110mg | Phosphorus: 329mg | Zinc: 3mg
