,name,image,description,prep_time,cook_time,total_time,servings_number,servings_unit,course,cuisine,diet,ingredients,instructions,nutrition
68,Kashmiri Biryani,https://www.vegrecipesofindia.com/wp-content/uploads/2013/06/kashmiri-biryani-recipe-11-280x280.jpg,"This Kashmiri Biryani is from the Kashmiri Pandit style of cooking. It is made without onions and garlic biryani and includes mix vegetables, herbs, spices and nuts.",40minutes,30minutes,1hour,5,,Main Course,"Indian, Kashmiri",Vegetarian,For rice▢ 1.25 cup basmati rice – soaked in water for 30 minutes ▢ 5 cups water – to cook the rice▢ salt as required▢ 1 pinch saffron strands,"Cooking ricePick and rinse basmati rice in running water till the water runs clear of starch. Then, soak the basmati rice in water for 30 minutes.After 30 minutes, drain the water and keep the rice aside. In a pot boil 5 cups water and then add the soaked rice.Cook the rice till they are ¾ᵗʰ cooked or 75% cooked. Then, drain the rice in a colander. Sprinkle a pinch of saffron strands all over the rice.Keep the rice covered so that the grains don't dry out.Preparing veg gravyChop cauliflower, potatoes, carrots, mint leaves and coriander leaves. Also, soak 2 pinches of saffron strands in ⅔rd cup warm water, warm milk or warm yogurt. Heat ghee or oil in a pan or pressure cooker.Add the whole spices – caraway seeds, cinnamon sticks, black cardamom, green cardamoms, cloves and mace.Fry till the spices splutter and become fragrant.Now, add the chopped vegetables – cauliflower, carrots, potatoes and green peas. Sauté the vegetables for 1 to 2 minutes.Then, add the spice powders – fennel powder, dried ginger powder, red chili powder, garam masala powder or Kashmiri Ver Masala, asafoetida and grated nutmeg. Sauté for 2 minutes. Keep on stirring.Put the heat on low, add the beaten yogurt and stir well. Add water and salt as required. Mix well.Cover the pan with its lid and cook on medium-low heat till the vegetables are tender. If there is too much water in the gravy, then simmer till some water dries up. The gravy should be of medium or slightly thick consistency and should not be runny or watery.If using pressure cooker, then pressure cook for 1 to 2 whistles till the vegetables are tender. Don’t over cook the veggies.Assembling Kashmiri BiryaniIn a heavy thick bottomed pan, layer half of the vegetable gravy first.Next, layer half of the cooked rice.Sprinkle some of the chopped mint and coriander leaves.Also, sprinkle some of the saffron which was dissolved in warm milk, warm water or warm yogurt.Now, layer with the rest of vegetable gravy.Next, layer with the remaining cooked rice.Sprinkle the mint, coriander and saffron milk again.Cooking Kashmiri BiryaniThen, cover the pan or pot with a tight fitting lid.Take a tawa or skillet and put it on medium heat. You can begin to preheat the tawa when you begin to assemble and layer the biryani.When the tava becomes hot, then lower the heat. Keep the sealed biryani pot on the tava. Keep the heat to the lowest and dum-cook biryani for 25 to 30 minutes. Alternatively, you can also dum-cook the biryani for the first 15 minutes on direct low heat and then for the last 10 minutes, place the pot on the hot tava and cook on low heat.After 25 to 30 minutes, switch off the heat. Give a standing time of 5 to 7 minutes and then check the biryani. If there is still some liquid at the bottom, then the biryani needs to be dum-cooked for some more time. Cook till all the liquids is absorbed.When the Kashmiri Biryani is getting dum-cooked, you can roast the cashewnuts or fry them in some oil or ghee. Alternatively, you can also roast a mix of cashewnuts, raisins and almonds or fry them in some oil.While serving, garnish with the roasted or fried cashewnuts, almonds and raisins along with some mint leaves.Serve the Kashmiri Biryani hot with a raita by the side.",NutritionCalories: 333kcal | Carbohydrates: 47g | Protein: 7g | Fat: 13g | Saturated Fat: 7g | Polyunsaturated Fat: 1g | Monounsaturated Fat: 4g | Cholesterol: 26mg | Sodium: 517mg | Potassium: 304mg | Fiber: 4g | Sugar: 3g | Vitamin A: 2553IU | Vitamin B1 (Thiamine): 1mg | Vitamin B2 (Riboflavin): 1mg | Vitamin B3 (Niacin): 2mg | Vitamin B6: 1mg | Vitamin B12: 1µg | Vitamin C: 13mg | Vitamin D: 1µg | Vitamin E: 1mg | Vitamin K: 10µg | Calcium: 90mg | Vitamin B9 (Folate): 27µg | Iron: 2mg | Magnesium: 55mg | Phosphorus: 146mg | Zinc: 2mg
69,Vegetable Biryani Recipe (Restaurant Style),https://www.vegrecipesofindia.com/wp-content/uploads/2024/06/vegetable-biryani-4-280x280.jpg,"This Veg Biryani recipe is a fragrant, lightly spiced restaurant-style biriyani made with freshly ground biryani masala, caramelized onions, mixed vegetables, yogurt, and herbs. Each layer of rice and vegetable gravy blends beautifully, giving the dish its rich flavor and aroma. The recipe is simple to follow and turns out hearty and delicious every time. Serve it hot with raita of choice for a complete and satisfying meal.",45minutes,45minutes,1hour,4,,Main Course,"Indian, North Indian","Gluten Free, Vegetarian","For rice layer▢ 1.5 cups basmati rice – 300 grams▢ 3 to 4 green cardamoms▢ 1 inch cinnamon▢ 1 tej patta – medium size, (Indian bay leaf)▢ 2 star anise▢ 1 black cardamom▢ 5 cups water –  for cooking rice▢ ¾ teaspoon salt or add as required","Cooking RiceRinse the rice very well in water till it runs clear of starch. Then soak the rice for 30 minutes in enough water. After 30 minutes strain the rice using a colander or a fine strainer.Heat water first in a deep bottomed pan. Add all the whole spices – green cardamom, cloves, cinnamon, black cardamom, star anise, tej patta and strand of mace.Cook the rice till the grains are 75% cooked. They should have a slight bite to them.Drain all the water from the rice in a colander thoroughly and keep aside.Making Biryani MasalaIn a spice grinder or small dry grinder, grind all the spices listed above, under the heading ""For Biryani Masala"" to a fine powder. Set aside.Making Vegetable GravyHeat oil in the 3 litre stovetop pressure cooker or pan.Add the thinly sliced onions. Sauté them on a medium-low to medium heat, stirring often until they get golden. Lower the heat and then quickly remove ¼ cup of the sautéed onions from the pan and set aside.To the remaining ¾ cup of onions in the cooker or pan, add the ginger-garlic paste.Stir and sauté until the raw aroma of ginger-garlic goes dissipates.Now add the freshly ground biryani masala and red chilli powder. Stir to combibe.Add the mix chopped vegetables and green peas. Stir for some 3 to 4 mins on a low heat.Reduce the heat and add the curd or yogurt slowly, stirring it really well until it has been incorporated evenly with the vegetables. Now add water and salt. Mix very well. Pressure cook the veggies for 1 whistle.When the pressure settles down and drops naturally in the cooker, remove the lid and check the veggie gravy. The gravy consistency should be medium-thick or slightly thick.If the mixed vegetables are undercooked, keep the cooker on the stovetop and simmer the gravy without the lid till the vegetables are tender.If there is too much water in the gravy, simmer till some water dries up. The gravy should have a medium-thick or slightly thick consistency and should not be very watery or runny.Assembling & LayeringIn a small bowl take 2 tablespoons milk. Add saffron strands and mix well. Set aside for 10 to 15 minutes.If baking then use a oven-proof pyrex bowl or deep pan. If cooking on stove then use the same pan in which you cooked the veggies or a different one. You can make as many layers you want.Arrange half of the vegetable gravy in the pan or pyrex bowl.Now spread half of the cooked basmati rice on top of the vegetable gravy layer.Sprinkle half of the mint leaves, 1 tablespoon oil/ghee and the saffron milk.Also add half of the sautéed golden onions evenly on this layer.Top this layer with another layer of the vegetable gravy. Then again top evenly with a rice layer.And finally top with mint leaves, 1 tablespoon oil/ghee, saffron milk and fried onions.Making Vegetable BiryaniCover the pyrex bowl with an aluminium foil.If using a pan, then cover the pan with a moist muslin cloth or aluminum foil. Cover tightly with a lid. Gather the hanging edges of the muslin cloth and place or stick it on top of the lid.You can bake the biryani for 25 to 30 minutes in a preheated oven at 180 degree C/356 degrees F.If cooking on stovetop, then first heat up a tawa/griddle for a few minutes and then keep the biryani pan on the tawa. This way the bottom of the biryani won't get burnt. Lower the heat and let the biryani cook for 25 to 30 minutes or till all the liquids have been absorbed and the rice grains look tender and fluffier.Once cooked, give a resting time of 5 to 7 minutes before you serve.Serve restaurant style Vegetable Biryani hot with some raita, pickle, salad and papad.",NutritionCalories: 583kcal | Carbohydrates: 87g | Protein: 12g | Fat: 21g | Saturated Fat: 3g | Polyunsaturated Fat: 1g | Monounsaturated Fat: 16g | Cholesterol: 9mg | Sodium: 819mg | Potassium: 866mg | Fiber: 8g | Sugar: 10g | Vitamin A: 5558IU | Vitamin B1 (Thiamine): 0.3mg | Vitamin B2 (Riboflavin): 0.3mg | Vitamin B3 (Niacin): 3mg | Vitamin B6: 1mg | Vitamin B12: 0.3µg | Vitamin C: 35mg | Vitamin D: 0.2µg | Vitamin E: 8mg | Vitamin K: 17µg | Calcium: 192mg | Vitamin B9 (Folate): 68µg | Iron: 3mg | Magnesium: 79mg | Phosphorus: 268mg | Zinc: 2mg
70,Nei Choru | Neychoru Recipe (Kerala Style),https://www.vegrecipesofindia.com/wp-content/uploads/2017/01/nei-choru-recipe-1-280x280.jpg,"The Nei Choru or Neychoru from ‘God’s own country’ Kerala is just another variation of a delish ghee rice. This delicacy is a Malabar special and made with rice, ghee, spices and dry fruits. This recipe uses a special variety of rice called ‘kaima rice’ or ‘jeerakasala rice.’",15minutes,25minutes,40minutes,4,,Main Course,"Kerala, South Indian","Gluten Free, Vegetarian",▢ 1.5 cups kaima rice (seeraga samba rice) or basmati rice – 300 grams▢ 4 tablespoons Ghee (clarified butter)▢ 12 to 15 cashews▢ 1 tablespoon raisins▢ 1 cup thinly sliced onions▢ 1 tej patta (Indian bay leaf)▢ 1 inch cinnamon▢ 3 cloves▢ 3 green cardamoms▢ 3 cups water▢ salt as required▢ 1 to 2 tablespoon coriander leaves (cilantro) – for garnish,"PreparationRinse kaima rice (seeraga sambar rice) or basmati rice in water a couple of times. Then soak rice grains in enough water for 20 to 30 minutes. Later drain the water and keep the soaked rice aside.Heat ghee in a pan. Keep the heat to low or medium.Add ½ cup thinly sliced onions.Mix and begin to sauté the onions on a low to medium heat till they turn crisp and golden. Remove all of the fried onions with a slotted spoon and keep aside.In the same pan, add 12 to 15 cashews and fry till golden.Remove with a slotted spoon and keep aside.Next add 1 tablespoon raisins. When the raisins puff up, remove and keep aside.Making nei choruTo the same pan, add the whole spices – tej patta, cinnamon, cloves, green cardamoms. Fry on low heat till the spices splutter and crackle.Next add ½ cup of thinly sliced onions and sauté till they turn translucent.Then add the rice.Season with salt as per taste. Gently mix the rice with the remaining ingredients.Add 3 cups water. Mix well. Check the taste of the water and it should taste slightly salty. If not, then add some salt.Cover the pan with its lid. On a low heat simmer till the water is absorbed and the rice grains are tender, fluffy and cooked well.Once done, gently fluff the rice.Serve Neychoru garnished with the fried onions, cashews and raisins. Also garnish with some chopped coriander leaves. You can also serve Nei Choru with a coconut based vegetable curry or any dal.",NutritionCalories: 423kcal | Carbohydrates: 65g | Protein: 7g | Fat: 15g | Saturated Fat: 8g | Polyunsaturated Fat: 1g | Monounsaturated Fat: 4g | Cholesterol: 33mg | Sodium: 306mg | Potassium: 214mg | Fiber: 2g | Sugar: 4g | Vitamin A: 8IU | Vitamin B1 (Thiamine): 1mg | Vitamin B2 (Riboflavin): 1mg | Vitamin B3 (Niacin): 1mg | Vitamin B6: 1mg | Vitamin C: 3mg | Vitamin E: 1mg | Vitamin K: 2µg | Calcium: 40mg | Vitamin B9 (Folate): 14µg | Iron: 1mg | Magnesium: 41mg | Phosphorus: 125mg | Zinc: 1mg
71,Mexican Rice Recipe (Arroz Rojo),https://www.vegrecipesofindia.com/wp-content/uploads/2021/06/mexican-rice-1-280x280.jpg,"Mexican Rice, also known as Arroz Rojo or Spanish Rice, is a zesty and flavorful vegan dish. This Mexican rice recipe features hearty long-grained rice, sauteed with tomatoes and lots of veggies and spices.",5minutes,25minutes,30minutes,3,,Main Course,"Mexican, World","Gluten Free, Vegan, Vegetarian","▢ 2 tablespoons olive oil▢ ½ cup finely chopped onions – 50 grams or 1 medium sized▢ ½ teaspoon finely chopped garlic or 3 to 4 small to medium-sized garlic cloves▢ 1 cup long grained rice  (heaped), 200 grams – basmati or any long grained rice variety▢ ¼ to ⅓ cup finely chopped carrots▢ ¼ to ⅓ cup finely chopped red bell peppers or any colored bell pepper or capsicum▢ ¼ to ⅓ cup green peas  – fresh or frozen, optional▢ 1 teaspoon chopped serrano peppers or jalapeño or green chillies▢ 1 teaspoon finely chopped celery▢ ½ teaspoon cayenne pepper  or paprika or red chilli powder or ¼ teaspoon ground black pepper▢ ½ teaspoon ground cumin (cumin powder)▢ 1 cup Tomato Purée – 200 grams, 2 medium to large tomatoes or 1.25 cups chopped tomatoes▢ salt as required▢ 1.75 to 2 cups Vegetable Stock or water – add as required","First, rinse the long grained or basmati rice under cold running water for a couple of times. Set the rinsed rice aside, and prep, gather all of the remaining ingredients needed.Heat olive oil in a pan.Add the chopped onions, garlic and sauté them for a minute on medium heat.Lower the heat and add the rinsed rice. Mix well, and stir continuously as you sauté the rice in the oil on a low to medium-low heat. The outside of the rice should start to get slightly browned, but take care not to burn the grains. The rice grains should become a light brown and opaque.Add the carrots, bell peppers, green peas, and serrano or jalapeño or green chilies, celery, cayenne (or paprika or red chilli powder) and ground cumin. Add salt according to taste.Mix and sauté for 2 to 3 minutes on a low to medium-low heat. Add tomato puree. Combine and Mix gently.Add the vegetable stock or water. Mix again and taste the broth. It should be a bit salty.Cover with lid and simmer on a low to medium-low heat until the rice grains are tender and fluffy for about 20 to 22 minutes. All of the stock should be absorbed. While the rice is cooking, keep checking a couple of times. If there are no liquids left in the pan and the rice grains are undercooked, add  ¼ cup hot water/hot veg stock or more as needed. Gently mix without breaking the rice grains. Cover and continue to simmer.When the cooking is completely, fluff the cooked rice with a fork. Serve Mexican rice hot or warm with a side salad or with Mexican sides like a vegetarian or vegan burrito, quesadilla, empanada or chimichanga.You can also serve with a side of lemon wedges and sprinkling of cilantro if desired.",NutritionCalories: 351kcal | Carbohydrates: 58g | Protein: 6g | Fat: 10g | Saturated Fat: 1g | Polyunsaturated Fat: 1g | Monounsaturated Fat: 7g | Sodium: 25mg | Potassium: 368mg | Fiber: 3g | Sugar: 5g | Vitamin A: 2937IU | Vitamin B1 (Thiamine): 1mg | Vitamin B2 (Riboflavin): 1mg | Vitamin B3 (Niacin): 2mg | Vitamin B6: 1mg | Vitamin C: 33mg | Vitamin E: 2mg | Vitamin K: 17µg | Calcium: 46mg | Vitamin B9 (Folate): 36µg | Iron: 1mg | Magnesium: 35mg | Phosphorus: 118mg | Zinc: 1mg
72,Aloo Biryani | Potato Dum Biryani,https://www.vegrecipesofindia.com/wp-content/uploads/2017/01/dum-aloo-biryani-recipe-1-280x280.jpg,"This Aloo Biryani is a layered, dum-cooked biryani made with baby potatoes, basmati rice, dry fruits, spices and herbs.",30minutes,30minutes,1hour,4,,Main Course,"Hyderabadi, South Indian",Vegetarian,for cooking rice▢ 1.5 cups basmati rice or 300 grams basmati rice▢ 5 cups water for cooking rice▢ 1 teaspoon salt or add as required▢ 1 small to medium tej patta (indian bay leaf)▢ 2 cloves▢ 2 green cardamoms▢ 1 inch cinnamon▢ 3 to 4 strands of mace,"cooking riceRinse 1.5 cups basmati rice (300 grams) very well in water till the water runs clear of starch. Soak rice grains in enough water for 30 minutes. On a medium to high flame, bring to boil 5 cups water, 1 teaspoon salt, 1 small to medium tej patta, 2 cloves, 2 green cardamoms, 1 inch cinnamon, 3 to 4 strands of mace.When the water comes to boil, add the rice. Do not reduce the heat and cook the rice.Cook rice till its ¾th done or 75% cooked. Check the doneness by biting a few grains of rice. You should get a slight bite in the rice.Then drain all the water from the rice in a colander. If you want you can even rinse the cooked rice with fresh water. Keep aside.preparation to make gravy for biryaniIn a chutney grinder jar or small grinder, take 2 green chillies, ¼ cup chopped coriander leaves, 2 tablespoons chopped mint leaves, ½ inch ginger (roughly chopped), 5 small to medium garlic (roughly chopped).Add ⅓  cup fresh curd (yogurt).Grind or blend to smooth or a semi fine paste. Keep aside.Heat 3 tablespoons ghee (clarified butter) in a pan.When the ghee becomes hot, add peeled baby potatoes (250 grams or 12 to 15 baby potatoes). If the potatoes are large, then halve or quarter them and then add.Fry the potatoes on medium heat till they are 90% cooked or almost cooked.Remove with a slotted spoon and place the potatoes on kitchen paper towels.Next add 15 cashews in the pan and fry till the cashews become golden. Remove and keep aside.Next add ½ tablespoon raisins and fry till they become plump. Remove and keep aside.In the same pan now add the following spices – 1 inch cinnamon, 3 green cardamoms, 2 cloves, 1 black cardamom and 1 small to medium tejpatta. The oil will be hot, so the spices will crackle as soon as you add them.Quickly add 1 cup tightly packed thinly sliced onions.Begin to saute the onions on low to medium flame stirring often till they turn golden or caramelize. Then quickly remove half of the fried onions from the pan.Keep the fried onions aside along with remaining fried ingredients.making gravy for biryaniNow add ½ cup chopped tomatoesSauté the tomatoes till they turn mushy.Keep the flame to a low and add ½ teaspoon turmeric powder, ½ teaspoon red chilli powder, 1 teaspoon coriander powder and 1 teaspoon biryani masala powder or garam masala powder. Mix very well.Then add the ground paste. mix very well and saute the masala till you see oil releasing from the sides. Now add ½ cup water. season with salt as per taste. Mix very well.Add half of the fried potatoes and mix again. Simmer the gravy on a medium flame for  8 to 9 minutes or till the gravy thickens a bit. Keep aside.assembling and layering aloo dum biryaniWhen the gravy is cooking, soak 1 pinch of saffron (kesar) in 3 tablespoons warm water. Keep aside.Now take half of the gravy and layer it in thick bottomed pan.Layer half of the rice.Next add some of the fried potatoes, cashews and raisins. layer with some of the fried onions.Add half of the saffron dissolved water.Repeat the gravy, rice, fried potatoes, onions, cashews and raisins layer. Add the remaining saffron soaked water. Also add 2 teaspoons rose water or kewra water.dum cooking potato biryaniSeal the pan with aluminium foil.Cover the pan with its lid and place it on a preheated tava or griddle. Preheat the tawa on a low to medium flame for 5 minutes before you place the pan.Dum cook potato biryani on low flame or sim for 30 minutes. If baking – preheat the oven to 180 degree celsius and then bake in a preheated oven for 25-30 minutes. Please remember to use an oven proof glass utensil like the pyrex bowl for baking in the oven. You will have to assemble the biryani as mentioned above in the ovenproof utensil. Cover with aluminum foil or the pyrex bowl lid and then bake.Give a resting time of 5 to 7 minutes and check the biryani. If you see a lot of gravy in the biryani, then cover and continue to dum cook. There should be no liquid or gravy at the bottom of the pan. If there is some gravy, then seal again and continue to dum cook for some more minutes.You can garnish with some mint or coriander leaves if you want. Serve the potato biryani hot or warm with your favorite raita or salan or biryani shorba or curd.",NutritionCalories: 499kcal | Carbohydrates: 81g | Protein: 9g | Fat: 16g | Saturated Fat: 8g | Polyunsaturated Fat: 1g | Monounsaturated Fat: 5g | Cholesterol: 31mg | Sodium: 700mg | Potassium: 610mg | Fiber: 6g | Sugar: 6g | Vitamin A: 453IU | Vitamin B1 (Thiamine): 1mg | Vitamin B2 (Riboflavin): 1mg | Vitamin B3 (Niacin): 2mg | Vitamin B6: 1mg | Vitamin B12: 1µg | Vitamin C: 24mg | Vitamin D: 1µg | Vitamin E: 1mg | Vitamin K: 9µg | Calcium: 111mg | Vitamin B9 (Folate): 32µg | Iron: 3mg | Magnesium: 74mg | Phosphorus: 201mg | Zinc: 2mg
73,Saffron Rice | Yellow Rice (Indian Style),https://www.vegrecipesofindia.com/wp-content/uploads/2021/08/yellow-rice-saffron-rice-280x280.jpg,"Saffron Rice or Yellow Rice is a deeply aromatic and flavorful side dish that pairs well with nearly any curry or lentil dish. The taste is slightly earthy and spiced, but not spicy or overly bold.",30minutes,10minutes,40minutes,3,,Main Course,Indian,"Gluten Free, Vegetarian","▢ 3 tablespoons Ghee or oil▢ 1 teaspoon caraway seeds (shahi jeera)▢ 2 to 3 green cardamoms▢ 1 tej patta (indian bay leaf)▢ 1.5 inches cinnamon▢ 2 to 3 cloves▢ 1 single, thin strand of  mace▢ 1.5 cups basmati rice▢ 2 to 3 generous pinches saffron (kesar), not a chef's pinch but a pinch of the thumb and index finger▢ 1 pinch turmeric – optional▢ 3 to 3.25 cups water or as required▢ salt as required▢ 2 to 3 tablespoons coriander leaves – chopped, or mint leaves for garnish – optional","Prepping and Soaking riceRinse the rice for 3 to 4 times in water or till the water runs clear of starch. Soak the rice for 20 to 30 mins in water. Drain the water and keep the rice aside.Gather all the ingredients, measure and set them aside.Crush the saffron strands with your fingers or in a mortar-pestle. Set aside.Making saffron riceHeat oil or ghee in a deep pan or pot. Lower the heat. Add all the whole spices – caraway seeds, green cardamoms, cinnamon, cloves, tej patta and mace strand.Fry for some seconds until the spices crackle taking care they do not burn.Then add the soaked rice. Mix and stir gently for 1 to 2 minutes so that the fat coats the rice grains.Add the crushed saffron strands to the rice.Add turmeric powder now if you plan to add it. Mix gently.Pour water and season with salt according to taste. Taste the water and it should be slightly salty. Cover the pan tightly and let the rice cook till the grains become separately cooked and absorb all the water.Do check the rice for a couple of times when it is cooking. If it looks like the water is simmering off too quickly, and more water 1 tablespoon at a time. Once done, fluff gently with a fork.Serve the Saffron Rice garnished with coriander or mint leaves with any lentil or vegetable curry of your choice.",NutritionCalories: 481kcal | Carbohydrates: 76g | Protein: 7g | Fat: 16g | Saturated Fat: 10g | Polyunsaturated Fat: 1g | Monounsaturated Fat: 5g | Cholesterol: 38mg | Sodium: 407mg | Potassium: 149mg | Fiber: 2g | Sugar: 1g | Vitamin A: 30IU | Vitamin B1 (Thiamine): 1mg | Vitamin B2 (Riboflavin): 1mg | Vitamin B3 (Niacin): 2mg | Vitamin B6: 1mg | Vitamin C: 1mg | Vitamin E: 1mg | Vitamin K: 1µg | Calcium: 51mg | Vitamin B9 (Folate): 9µg | Iron: 1mg | Magnesium: 33mg | Phosphorus: 115mg | Zinc: 1mg
