,name,image,description,prep_time,cook_time,total_time,servings_number,servings_unit,course,cuisine,diet,ingredients,instructions,nutrition
19,Indian Paneer Fried Rice Recipe,https://www.vegrecipesofindia.com/wp-content/uploads/2015/09/paneer-fried-rice-recipe-1-280x280.jpg,"This Paneer Fried Rice is an Indian inspired delicious recipe of a mildly spiced, savory stir fried rice made with tender paneer, healthy mixed vegetables, fragrant spices and herbs.",30minutes,20minutes,50minutes,3,,Main Course,Indian,"Gluten Free, Vegetarian","For cooking rice▢ 1 cup rice – heaped, regular or basmati rice or long grained rice – 200 grams or 3 to 3.5 cups leftover cooked rice▢ 1.75 cups water▢ ½ teaspoon oil – any neutral flavored oil▢ ¼ teaspoon salt or add as required","Cooking riceRinse the regular rice or basmati rice very well in water for a few times. Then soak the rice grains in water for 20 to 30 minutes.After 20 to 30 minutes, drain and add the rice in a pressure cooker. Add salt.Pour 1.75 cups of water and oil.Stir and pressure cook the rice for 2 whistles or for about 8 to 10 minutes on medium to medium-high heat. When the pressure falls on its own in the cooker, remove the lid and gently fluff the rice. You can also cook the rice in a pot. If using leftover cooked rice, add 3 to 3.5 cups.Transfer the cooked rice grains in a large tray or plate and let them cool completely at room temperature, before you proceed further with stir-frying. Prepping veggiesMeanwhile, when the rice is soaking, you can do the prep work by grating or shredding the carrot, thinly slicing the french beans, finely chopping the capsicum, onion and tomato.Making paneer fried riceHeat oil in a deep pan or kadai (wok) and add caraway seeds or cumin seeds. Fry till they splutter.Then add the finely chopped onions and sauté stirring often till they turn translucent.Add the ginger-garlic paste and sauté for some seconds till the raw aroma of ginger-garlic goes away.Next add the chopped tomatoes. Mix well and sauté till the tomatoes soften and turn mushy.Now add the thinly sliced french beans. Stir fry on a medium heat for 3 to 4 minutes.Then add the grated carrots and finely chopped capsicum. Mix and continue to stir fry on a medium heat for 4 to 5 minutes.Then add paneer cubes. Also sprinkle some the crushed black pepper or pepper powder, red chili powder and garam masala powder. Stir and mix very well.Then add the cooked rice. Season with salt as required.Gently stir and mix everything very well. You can add the rice in parts if you prefer. Check the taste and add more of the ground spice powders or salt according to your taste preferences.Serve paneer fried rice hot or warm with a side veggie salad or raita. I usually serve this dish with raita varieties like onion raita or boondi raita or cucumber raita. However it also tastes good even without any accompaniments or sides.",NutritionCalories: 584kcal | Carbohydrates: 57g | Protein: 17g | Fat: 32g | Saturated Fat: 14g | Polyunsaturated Fat: 1g | Monounsaturated Fat: 9g | Cholesterol: 55mg | Sodium: 628mg | Potassium: 268mg | Fiber: 3g | Sugar: 3g | Vitamin A: 2781IU | Vitamin B1 (Thiamine): 1mg | Vitamin B2 (Riboflavin): 1mg | Vitamin B3 (Niacin): 1mg | Vitamin B6: 1mg | Vitamin C: 20mg | Vitamin E: 5mg | Vitamin K: 8µg | Calcium: 443mg | Vitamin B9 (Folate): 21µg | Iron: 1mg | Magnesium: 29mg | Phosphorus: 98mg | Zinc: 1mg
20,Mushroom Pulao,"https://www.vegrecipesofindia.com/wp-content/uploads/2010/09/mushroom-pulao-recipe-1-280x280.jpg 280w, https://www.vegrecipesofindia.com/wp-content/uploads/2010/09/mushroom-pulao-recipe-1-500x500.jpg 500w, https://www.vegrecipesofindia.com/wp-content/uploads/2010/09/mushroom-pulao-recipe-1.jpg 523w","This is a mild, flavorful mushroom pulao made with white button mushrooms, basmati rice, thick coconut milk, aromatics and herbs. It makes for an easy and quick lunch or dinner.",25minutes,20minutes,45minutes,3,,Main Course,Goan,"Vegan, Vegetarian","Main ingredients▢ 3 tablespoons oil▢ 1.5 cups basmati rice – you can use any type of long grained rice▢ 200 to 250 grams white button mushrooms, sliced or chopped▢ 85 grams onion or 1 medium size onion, thinly sliced or finely chopped, about ⅓ to ½ cup sliced or chopped onions▢ 1 tomato – medium-sized or ⅓ cup chopped tomatoes▢ 1 potato – medium-sized, peeled & cubed, optional▢ 1 to 2 green chilies – chopped▢ ½ tablespoon Ginger Garlic Paste or 1 inch ginger + 6 to 7 garlic, crushed in mortar-pestle▢ 1 cup Coconut Milk (Thick)▢ 1.5 to 1.75  cups water or add a total of of 2.5 to 2.75 cups water minus the coconut milk. Check point 1 below in the notes.▢ salt or sea salt as required","PreparationClean, wash and soak the rice for 20 to 30 minutes. When the rice is getting soaked, chop all the veggies. Rinse and chop the mushrooms too.Take all the whole garam masala and keep it aside.After 20 to 30 minutes drain all the water from the rice. Set the soaked rice aside.Making mushroom pulaoIn a pressure cooker, heat oil. Add the whole garam masala including cumin, and fry till they become fragrant. About few seconds.Add the onions and fry them stirring often till they become light golden.Add the ginger-garlic paste and saute for a few seconds or till the raw smell of the paste disappears.Now add the chopped tomatoes, potatoes and mushrooms. Saute for 4 to 5 minutes till the mushrooms are half cooked on low to medium heat. Keep on stirring in between.Add the soaked rice and the chopped green chili.Saute the rice for 1 to 2 minutes stirring in between on a low heat.Add the coconut milk and water. Stir and season with salt as per taste. Mix very well.Check the taste of the broth and it should taste slightly salty.Pressure cook the mushroom pulao for 2 to 3 whistles or for 9 to 10 minutes. If using 3-liter cooker, pressure cook for 2 whistles and for a 2 litre cooker, pressure cook for 3 whistles.When the pressure settles down on its own, then only remove the lid and gently fluff the rice with a fork.Garnish with coriander leaves or mint leaves and serve mushroom pulao with sliced onions and lime. You could also have it with onion-tomato raita or any raita of your choice.",NutritionCalories: 660kcal | Carbohydrates: 86g | Protein: 11g | Fat: 31g | Saturated Fat: 16g | Polyunsaturated Fat: 1g | Monounsaturated Fat: 13g | Sodium: 462mg | Potassium: 664mg | Fiber: 4g | Sugar: 4g | Vitamin A: 355IU | Vitamin B1 (Thiamine): 1mg | Vitamin B2 (Riboflavin): 1mg | Vitamin B3 (Niacin): 5mg | Vitamin B6: 1mg | Vitamin B12: 1µg | Vitamin C: 12mg | Vitamin D: 1µg | Vitamin E: 6mg | Vitamin K: 5µg | Calcium: 72mg | Vitamin B9 (Folate): 41µg | Iron: 5mg | Magnesium: 79mg | Phosphorus: 262mg | Zinc: 2mg
21,Carrot Rice Recipe (Easy & Healthy),https://www.vegrecipesofindia.com/wp-content/uploads/2025/04/carrot-rice-2-280x280.jpg,"This South Indian style Carrot Rice recipe is lightly spiced and delicious rice preparation made with grated carrots, aromatics, spices, herbs, cashews and cooked rice. It can be made quickly if you have leftover cooked rice. Lightly spiced and mildly sweet from carrots, it's perfect for lunchboxes or as a quick, nutritious meal.",15minutes,15minutes,30minutes,2,,Main Course,South Indian,Vegan,For cooking rice▢ ½ cup rice (short to medium grained) or basmati rice or 3 cups cooked rice▢ ¾ to 1 cups water – for pressure cooking▢ ⅛ teaspoon salt or add as required,"Cooking riceSoak rice in a bowl in enough water for 30 minutes. Drain and then set aside. You could use any rice like sona masuri, surti kolam or parimal rice or even basmati rice. I used hand pounded sona masuri rice.Add the rice in a 2 litre pressure cooker along with 0.75 to 1 cups water and salt (optional). Pressure cook for 2 whistles. Since this rice was hand pounded rice, I cooked for 3 whistles and added 1.25 cups water.You can also cook the rice in a pot or pan adding 3 to 3.5 cups water. Then drain the water once the rice grains are cooked. When the rice is cooking, peel and grate 2 medium sized carrots. Keep the grated carrots aside. Also slice 1 small onion and chop one green chili.When the pressure settles down on its own, open the lid of the cooker.Gently fluff the rice grains and allow them to cool completely. I cooled the rice in the cooker itself. But you can also take the rice grains in a large plate or tray to cool them.SautéingIn a pan heat the oil and add the thinly sliced onions.Stir and saute the onions on a low to medium heat until onions start to turn light golden. Add a pinch of salt for cooking the onions quickly.When the onions begin to get light golden, add the cashews and raisins. Mix very well.Sauté until the raisins become plump. By the time the raisins become plump, the onions will also get golden.Remove the onions, cashews and raisins with a slotted spoon and keep aside.Making carrot riceIn the same pan, some oil will be left. Lower the heat. Now add mustard seeds, tej patta, cinnamon, cardamoms and cloves.Stir and sauté until the mustard crackles.Now add the chopped green chilies, curry leaves and a pinch of asafetida (optional).Stir and saute for half a minute. Add the grated carrots. Mix very well.Saute the carrots for about 3 minutes on a low to medium heat. Depending on the size of gratings, the sautéing can take less or more time.Add the steamed rice and stir. Season with salt. Again mix very well and switch off the flame.Lastly add the fried onions, cashews and raisins. Also add chopped coriander leaves.Mix very well. You can also garnish carrot rice with the fried onions, cashews and raisins while serving.Serve carrot rice with a side raita or salad.Serving suggestionsServe carrot rice with a side of a raita or salad. You can even pack it as a tiffin box lunch with some chutney or a veggie stir fry.The tangy sour flavors of an onion-tomato salad combine nicely with the mild, sweet flavors of this carrot rice.In fact a tangy tomato salad or even a mayo salad will pair greatly. If you do not have any veggies, simply serve carrot rice with a simple plain curd (yogurt).StorageThough you mostly won't have any leftovers, but in case if you do have, then refrigerate and consume within a day. Do not keep for a longer time in the fridge. Rice is best had when freshly made.",NutritionCalories: 351kcal | Carbohydrates: 50g | Protein: 6g | Fat: 15g | Saturated Fat: 2g | Sodium: 767mg | Potassium: 272mg | Fiber: 3g | Sugar: 6g | Vitamin A: 5440IU | Vitamin B1 (Thiamine): 1mg | Vitamin B2 (Riboflavin): 1mg | Vitamin B3 (Niacin): 30mg | Vitamin B6: 1mg | Vitamin C: 53mg | Vitamin E: 5mg | Vitamin K: 8µg | Calcium: 34mg | Vitamin B9 (Folate): 307µg | Iron: 1mg | Magnesium: 42mg | Phosphorus: 127mg | Zinc: 1mg
22,Pudina Rice Recipe | Spicy Pudina Pulao (Mint Rice),https://www.vegrecipesofindia.com/wp-content/uploads/2018/09/pudina-pulao-recipe-1-280x280.jpg,"This one-pot Pudina Rice or Mint Rice is a fragrant, spicy and tasty dish made with fresh mint leaves, basmati rice, onion, tomato, spices and herbs. I also include some potatoes and green peas in the Pudina Pulao to make it hearty, flavorful and a satisfying dish.",30minutes,15minutes,45minutes,3,,Main Course,Indian,"Gluten Free, Vegan, Vegetarian","for the mint paste▢ 1 cup mint leaves – chopped, ▢ ½ cup coriander leaves – chopped (cilantro)▢ 1 to 2 green chillies – chopped▢ ½ inch ginger – chopped or ½ teaspoon chopped ginger▢ 3-4 garlic – chopped or ½ teaspoon chopped garlic▢ 1 tablespoon chopped coconut or 2 tbsp grated coconut or 2 tbsp coconut milk (you can also add 2 tbsp desiccated coconut if you don't have fresh coconut)▢ 1 teaspoon coriander seeds▢ ½ teaspoon cumin seeds▢ 2 to 3 tablespoon water for grinding or add as required","PreparationRinse the 1 cup basmati rice (200 grams) till the water runs clear of the starch. Soak the rice in water for 20 to 30 minutes.After 20 to 30 minutes, drain the water from the rice. Set the soaked rice aside.Meanwhile, when the rice is soaking, prep the other ingredients. Take the chopped mint leaves, coriander leaves, ginger, garlic, green chilies, chopped coconut or coconut milk or grated coconut, coriander seeds, cumin seeds in a chutney grinder or small grinder or blender.Add 2 to 3 tablespoons of water and grind to a smooth paste. Add more water if required while grinding.Making pudina riceHeat 2 tablespoons oil in a 2 litre stovetop pressure cooker. Add the following whole spices – cinnamon, tej patta, green cardamoms, cloves, mace strands and a small piece of stone flower. Adding stone flower is optional. On low heat, fry the spices for some seconds till they become aromatic.Then add sliced onions.Saute till the onions become golden. Then add the ground mint paste.Add turmeric powder and red chili powder. Stir and sauté the masala paste for a minute or two.Then add chopped potatoes, tomatoes and green peas. Stir and mix.Add the strained rice and stir gently. The oil should coat the rice grains well. Stir and sauté for a minute.Cooking pudina riceAdd 1.5 to 2 cups of water. Stir and mix well.I added 2 cups since I had used organic basmati rice and we prefer the rice grains to be cooked well. 1.5 cups will give an al dente texture and can be added for the regular Indian brands of basmati rice.Add salt as required. Stir and mix again.Cover the lid tightly and pressure cook on high heat for 2 to 3 whistles till the rice grains are cooked and tender.When the pressure settles down on its own, then only open the lid and gently fluff the rice.Serve Pudina Rice hot with plain curd (yogurt) or with onion-tomato raita or boondi raita. ",NutritionCalories: 425kcal | Carbohydrates: 74g | Protein: 8g | Fat: 11g | Saturated Fat: 2g | Sodium: 463mg | Potassium: 690mg | Fiber: 7g | Sugar: 4g | Vitamin A: 1261IU | Vitamin B1 (Thiamine): 1mg | Vitamin B2 (Riboflavin): 1mg | Vitamin B3 (Niacin): 3mg | Vitamin B6: 1mg | Vitamin C: 35mg | Vitamin E: 4mg | Vitamin K: 17µg | Calcium: 105mg | Vitamin B9 (Folate): 55µg | Iron: 3mg | Magnesium: 66mg | Phosphorus: 168mg | Zinc: 2mg
23,Mango Rice Recipe (Mavinakayi Chitranna),https://www.vegrecipesofindia.com/wp-content/uploads/2015/04/raw-mango-rice-recipe-1-280x280.jpg,"This Mango Rice recipe (also called as Mavinakayi Chitranna in Kannada) is tangy, comforting and loaded with flavors. It is made with unripe green mangoes, coconut, spices, peanuts, sesame seeds and herbs.",25minutes,15minutes,40minutes,4,,"Main Course, Side Dish","Indian, Karnataka",Vegan,For pressure cooking rice▢ 1.5 cup rice – any regular non-sticky short-grained or medium-grained Indian rice variety or basmati rice▢ ½ teaspoon salt▢ ½ teaspoon oil▢ 2.5 cups water,"Cooking riceFirst, soak rice in water for 20 minutes. Use any regular non-sticky rice or basmati rice.After 20 minutes, pressure cook the rice with 2.5 cups water, salt and oil for 2 whistles on high heat. You can also cook the rice in a pot. If cooking in a pot, then you may need to add more water.When the pressure settles down naturally, spread the rice on a plate. Keep aside and allow the rice to cool at room temperature. When the rice is warm, cover and keep so that the rice grains do not dry out.While the rice is cooking, rinse, peel and chop the raw mango.Making mango paste In a grinder jar, add the chopped mangoes along with dried red chilies (broken and deseeded), chopped green chili, sesame seeds, peanuts, grated coconut and powdered or grated jaggery. I added jaggery to balance the sourness of the mangoes. If you don't have dried red chilies, add a total of 2 to 3 green chilies. I used Byadgi red chilies which are not very hot. If using a hotter variety of red chilies, reduce the amount to 1 or 2.Without adding any water, grind to a semi-fine paste. Don't make a fine paste. Keep aside.Making mango riceIn a pan, heat oil and add peanuts.On low heat, sauté the peanuts till they change color.Then, bring the peanuts to the side of the pan and add mustard seeds in the center. Let the mustard seeds crackle. You can also add 1 teaspoon each of chana dal and urad dal at this step. If adding chana dal or urad dal, allow them to turn golden before you proceed to the next step.When the mustard seeds crackle, add curry leaves and dried red chilies. Stir and sauté till the red chilies change color.Then, add asafoetida and turmeric powder. Mix well.Now, add the ground raw mango-coconut-spices paste. Stir and sauté for 3 to 4 minutes on low to medium-low heat or until the mixture thickens more and comes together. Next, season with salt.Stir and mix very well again. Remove pan from the stovetop and set aside on the kitchen countertop.Add the sautéed raw mango-coconut-spices masala to the cooked rice. You can mix in batches or at once. The rice has to be at room temperature before you start mixing.Now, with your hands, gently mix the rice with the raw mango-coconut-spices masala. I mixed both the cooked rice and the masala in batches in a bowl.Serve Mango Rice with some fried papads or chips. You can also serve with some yogurt or pickle. While serving, you can also garnish Mango Rice with chopped coriander leaves if you prefer.",NutritionCalories: 530kcal | Carbohydrates: 74g | Protein: 10g | Fat: 22g | Saturated Fat: 6g | Polyunsaturated Fat: 5g | Monounsaturated Fat: 9g | Sodium: 634mg | Potassium: 332mg | Fiber: 5g | Sugar: 12g | Vitamin A: 983IU | Vitamin B1 (Thiamine): 1mg | Vitamin B2 (Riboflavin): 1mg | Vitamin B3 (Niacin): 38mg | Vitamin B6: 1mg | Vitamin C: 85mg | Vitamin E: 3mg | Vitamin K: 4µg | Calcium: 65mg | Vitamin B9 (Folate): 403µg | Iron: 2mg | Magnesium: 59mg | Phosphorus: 161mg | Zinc: 1mg
24,Yakhni Pulao Recipe (Vegetarian),https://www.vegrecipesofindia.com/wp-content/uploads/2012/02/yakhni-pulao-recipe-25a-280x280.jpg,"This Yakhni Pulao is a delicious vegetarian version of rice based pilaf featuring basmati rice, vegetable stock, mixed veggies, spices and herbs from the Hyderabadi cuisine.",25minutes,20minutes,45minutes,3,,Main Course,Hyderabadi,"Gluten Free, Vegetarian","For bouquet garni▢ 1 tablespoon coriander seeds▢ 1 teaspoon cumin seeds▢ ½ tablespoon fennel seeds▢ 1 inch ginger – crushed▢ 5 to 6  garlic cloves – small to medium, crushed","Making bouqet garniTake the coriander seeds, fennel seeds, cumin seeds and crushed ginger+garlic in a muslin cloth. Place them in the center. Tie the muslin cloth securely with the spices and ginger, garlic inside it. This is the bouquet garni.Making yakhni (stock)Heat water to a gentle boil in a pan or pot on medium heat. Add the mixed chopped veggies, green peas and salt as required. Also place the bouquet garni in the pan or pot.Cover the pan and cook the veggies till they are half-done or half-cooked on medium-low to medium heat. Take into account the cooking time of 10 to 12 minutes. The vegetables are not boiled here but cooked gently on a medium-low to medium heat.Through a strainer strain the stock or yakhni in a bowl and set the half-cooked veggies aside.When warm or cool, squeeze the bouquet garni over the bowl containing the stock to extract as much as flavors from the spices. Open the muslin and discard the spices.Measure 2 cups of the stock and set it aside. You can use the remaining veg stock to make soup, dal or any gravy dish.Making yakhni pulaoRinse basmati rice very well in water. Then soak the basmati rice in water for 20 to 30 minutes.Later drain the water and set the soaked rice aside.Heat ghee in a pan and let it melt.Add the whole spices – cloves, cinnamon, cardamom, bay leaves, black cardamom and peppercorns. Fry till they are fragrant for a few seconds.Add sliced onions. Stirring often, fry the onions until they are browned.Add the soaked basmati rice. Stir and mix the basmati rice well. Sauté gently on a low heat for 1 to 2 minutes.  Now add the half-cooked veggies and 2 cups of the broth or yakhni. Add salt if needed. Note that we have already added salt to the yakhni. Keep this in mind before adding the salt.Add curd (yogurt) and mix well.Cover pan with a tight- fitting lid.Cook for 15 to 20 minutes on dum on a low heat.Later open the pan. If the rice appears not be completely cooked and the mixture looks dry, simply add in a few splashes of some warm yakhni or broth to the rice. Gently stir with a fork. Cover tightly and cook for a few minutes more.If there is some stock in the pulao, then do not add any extra veg stock. Simply cover the pan and cook further for some more minutes. GarnishingTake one tablespoon ghee or oil in a pan. Add ⅓ cup thinly sliced onions.Once the onions changes to light brown color, you can add some cashews and continue to sauté with the onions. Sauté till the onion becomes golden brown. When serving, garnish yakhni pulao with crispy golden onions and cashew nuts. Sprinkle some chopped coriander or mint leaves. Serve veg yakhni pulao hot or warm with onion raita or with onion mint kuchumber.",NutritionCalories: 526kcal | Carbohydrates: 78g | Protein: 12g | Fat: 20g | Saturated Fat: 10g | Polyunsaturated Fat: 2g | Monounsaturated Fat: 7g | Cholesterol: 41mg | Sodium: 859mg | Potassium: 567mg | Fiber: 9g | Sugar: 5g | Vitamin A: 4861IU | Vitamin B1 (Thiamine): 1mg | Vitamin B2 (Riboflavin): 1mg | Vitamin B3 (Niacin): 3mg | Vitamin B6: 1mg | Vitamin B12: 1µg | Vitamin C: 25mg | Vitamin D: 1µg | Vitamin E: 1mg | Vitamin K: 10µg | Calcium: 150mg | Vitamin B9 (Folate): 59µg | Iron: 4mg | Magnesium: 94mg | Phosphorus: 247mg | Zinc: 2mg
25,Capsicum Rice Recipe (Indian Bell Pepper Rice),https://www.vegrecipesofindia.com/wp-content/uploads/2015/06/capsicum-pulao-recipe-1-280x280.jpg,"This Capsicum Rice or Bell Pepper Rice is an easy and delicious one pot dish made with green bell pepper or capsicum, basmati rice, onions, spices and herbs. The recipe comes together quickly under 40 minutes and is gluten-free and vegan.",20minutes,15minutes,35minutes,2,,Main Course,North Indian,"Gluten Free, Vegan","▢ 1 cup basmati rice – 200 grams▢ 2 tablespoons oil▢ 1 teaspoon cumin seeds▢ 2 green cardamoms▢ 2 cloves▢ 1 inch cinnamon▢ 2 tejpatta small or 1 medium to large tejpatta (Indian bay leaf)▢ 2 single thin, strands of mace▢ ½  cup onions – thinly sliced or 1 medium-sized onion▢ ¾ to 1 cup capsicum – sliced or 2 medium green bell peppers or capsicum – 75 to 80 grams▢ 3 tablespoon coriander leaves – chopped (cilantro) ▢ 4 to 5 drops lemon juice – optional▢ 1.75 cups water or add as required▢ salt as required","PreparationRinse basmati rice very well in water for 3 to 4 times.Then soak rice in enough water for 20 to 30 minutes. Later drain the water and set the rice aside.Meanwhile when the rice is soaking, slice the onions thinly. Also slice the capsicum.Making capsicum riceHeat in a 2 litre stovetop pressure cooker. Keep heat to a low. Add the whole spices – cumin seeds, green cardamoms, cloves, inch cinnamon, tejpatta, and strands of mace. Fry for a few seconds till the spices crackle and become fragrant.Next add the sliced onions.Mix very well and sauté stirring often on medium-low heat till the onions become golden.Lower the heat and add the sliced capsicum and chopped coriander leaves.Mix very well and sauté for 3 to 4 minutes on low to medium-low heat.Add the soaked rice. Gently stir to combine and sauté rice for a minute.Pour water and season with salt. Also add 3 to 4 drops of lemon juice. Mix again.Cover the pressure cooker with its lid and pressure cook capsicum rice on a medium to medium-high heat for 2 to 3 whistles.When the pressure falls down on its own naturally in the cooker, open the lid and gently fluff the capsicum rice.Serve Capsicum Rice or Bell Pepper Rice hot with an Indian curry or a dal (lentil based dish) or raita.",NutritionCalories: 506kcal | Carbohydrates: 83g | Protein: 8g | Fat: 15g | Saturated Fat: 2g | Polyunsaturated Fat: 1g | Monounsaturated Fat: 12g | Sodium: 603mg | Potassium: 317mg | Fiber: 4g | Sugar: 3g | Vitamin A: 277IU | Vitamin B1 (Thiamine): 1mg | Vitamin B2 (Riboflavin): 1mg | Vitamin B3 (Niacin): 2mg | Vitamin B6: 1mg | Vitamin C: 50mg | Vitamin E: 6mg | Vitamin K: 8µg | Calcium: 74mg | Vitamin B9 (Folate): 22µg | Iron: 2mg | Magnesium: 46mg | Phosphorus: 140mg | Zinc: 1mg
