,name,image,description,prep_time,cook_time,total_time,servings_number,servings_unit,course,cuisine,diet,ingredients,instructions,nutrition
0,Vegetable Dum Biryani | Hyderabadi Veg Dum Biryani,https://www.vegrecipesofindia.com/wp-content/uploads/2021/04/biryani-recipe-2-280x280.jpg,"Hyderabadi Veg Dum Biryani is a flavorful dum-cooked rice dish made with basmati rice, spiced vegetable gravy, herbs, nuts, raisins, yogurt and saffron. Each layer is slow-cooked so the rice absorbs the aroma of the masala gravy. The result is a rich, fragrant biryani with balanced flavors and soft, tender vegetables. Serve it hot with raita for a complete and satisfying meal.",45minutes,45minutes,1hour,5,,Main Course,"Hyderabadi, Indian","Gluten Free, Vegetarian","For soaking rice▢ 1.5 cups basmati rice – 300 grams, preferably aged basmati rice▢ 1 cup water for soaking rice","Soaking ricePick and rinse basmati rice in running water till the water runs clear of starch. Soak the rice in 1 cup of water for 30 minutes.After 30 minutes drain the rice and set aside.When the rice is soaking prep all the veggies and other ingredients. Set aside.Cooking riceTake a deep bottomed pan. Add water and heat the water on a high flame.When the water becomes hot, add the salt and following spices: tej patta, green cardamoms, cloves, black cardamom, cinnamon, strands of mace.Bring the water to a boil. Then add the soaked basmati rice.Just gently stir with a spoon or fork, after you add the soaked rice.Do not reduce the flame and continue to cook the rice grains.The rice has to be ¾ᵗʰ cooked. The grains should have a slight bite to them when cooked. The rice should not be fully cooked. Drain the rice in a colander. Gently fluff and keep aside.Making vegetable curry/gravyIn a 2-litre pressure cooker or a pan, heat ghee. Add the following spices – shahjeera, tej patta, green cardamoms, cloves, black cardamom and cinnamon. Sauté the whole spices till they crackle.Now add the onions. Stir and sauté them on a low to medium flame.Add a pinch of salt to quicken the cooking process.When the onions are cooking, take 1 cup fresh curd (yogurt) in a bowl and whisk the curd with a spoon or wired whisk till it become smooth.Sauté the onions till they become golden brown or caramelize.Then add the ginger-garlic paste and sliced green chillies. You can also finely chop the ginger-garlic and add.Sauté till the raw aroma of ginger-garlic goes away.Add the turmeric and red chili powder. Stir and mix well.Next add the chopped veggies. Sauté for a minute or two.Lower the heat and add the whisked curd (yogurt). Stir and mix well as soon as you add the curd. Then add ½ cup water in the pressure cooker. For cooking in a pan, add ¾ cup water.  Season with salt and mix again.Pressure cook for 1 whistle on 3 to 4 minutes on medium heat. If cooking in a pot, then cook until the vegetables are tender. Don’t over cook the vegetables.Warm 4 to 5 tablespoons milk in a microwave or in a small pan on the stove top. Add ¼ teaspoon of saffron strands. Stir and keep aside.When the pressure settles down on its own, remove the lid and check the gravy. If the vegetables are under cooked, then keep the cooker on the stove top and simmer the biryani gravy without the lid, till the vegetables are tender. If there is too much of water or stock in the gravy, then simmer until some of the water evaporates and dries up. Note that the vegetable gravy should have a medium or slightly thick consistency and should not be watery.Now add cashews, raisins and almonds (blanched or raw) to the vegetable gravy. Mix and stir. Set aside. Do a taste test and check the salt in the vegetable gravy. Add more if needed.Assembling and layeringNow in a thick bottomed pan, layer half portion of the vegetable gravy first.Then layer half portion of the semi-cooked rice.Sprinkle half of the chopped coriander leaves (cilantro), mint leaves and saffron milk.Layer the remaining vegetable gravy.Layer the last portion of the rice. Sprinkle the remaining coriander leaves, mint leaves, and saffron infused milk on the top. Sprinkle rose water or kewra water. You can make 2 layers or 4 layers like I have done. But do note that rice should be the top layer and the vegetable gravy should be the bottom layer. Dum cooking Now seal and secure the pot with an aluminium foil. Then cover with a lid. You can also seal the pan with a moist cotton cloth and then cover with a lid.Take a tava/griddle/skillet and heat it on medium flame.When the tawa become hot, then lower the flame. Keep the sealed biryani pan on the tawa. Keep the flame to the lowest and cook for 30 to 35 minutes. You can dum cook Hyderabadi Vegetable Dum Biryani for the first 15 minutes on a direct low flame and then for the last 10 minutes, place the pan on the hot tawa/skillet and cook on a low heat.Once done using a fork or spoon check the bottom layer of the biryani. There should be no liquids at the bottom. If there are liquids, then continue to dum cook for some more time. After dum cooking, give a resting time of 5 to 7 minutes and later serve the Hyderabadi Veg Dum Biryani. Serving SuggestionsWhile serving, make sure you equally serve the vegetables as well as the rice.There are various sides that pair best with a Veg Dum Biryani. Biryani is usually accompanied with a raita (yogurt dip). You can choose to pair it with Cucumber Raita, Onion Tomato Raita and Boondi Raita, or you could enjoy biryani with any savory raita of your liking.You can also pair it with Kachumber Salad (onion-tomato salad), plain Curd (Yogurt), Mango Pickle, some lemon wedges or roasted papad.The Hyderabadi Dum Biryani is usually served with Mirchi ka Salan (Green Chilly Curry) and raita. If desired you can serve biryani with a simple soupy Shorba gravy.You can also enjoy biryani as it is without any sides or accompaniments.StorageStore the biryani leftovers in your refrigerator for a day only. While reheating steam for 5 minutes in a pan or Instant pot. You could even lightly sauté the biryani stirring frequently in a frying pan or skillet until warm or hot.  ",NutritionCalories: 437kcal | Carbohydrates: 67g | Protein: 12g | Fat: 15g | Saturated Fat: 7g | Polyunsaturated Fat: 1g | Monounsaturated Fat: 2g | Cholesterol: 27mg | Sodium: 836mg | Potassium: 637mg | Fiber: 7g | Sugar: 10g | Vitamin A: 2712IU | Vitamin B1 (Thiamine): 1mg | Vitamin B2 (Riboflavin): 1mg | Vitamin B3 (Niacin): 3mg | Vitamin B6: 1mg | Vitamin B12: 1µg | Vitamin C: 37mg | Vitamin D: 1µg | Vitamin E: 1mg | Vitamin K: 17µg | Calcium: 152mg | Vitamin B9 (Folate): 58µg | Iron: 2mg | Magnesium: 78mg | Phosphorus: 250mg | Zinc: 2mg
1,Veg Pulao Recipe (Mix Vegetable Pulav),https://www.vegrecipesofindia.com/wp-content/uploads/2013/03/veg-pulao-recipe-280x280.jpg,"Trying to get more vegetables in your diet? Try this vegetarian one pot meal of Pulao or Pulav made with basmati rice, mixed veggies, spices and herbs. Use the vegetables that you like most, like peas, potatoes, and green beans. Make this simple Veg Pulao recipe that packs a punch of flavor!",15minutes,25minutes,40minutes,4,,Main Course,Indian,"Gluten Free, Vegan, Vegetarian","For soaking rice▢ 1.5 cups basmati rice – 300 grams, rinsed & soaked for 20 to 30 minutes▢ water – as required for soaking","PreparationRinse rice till the water runs clear of starch and become transparent while rinsing.Soak the rice in enough water for 20 to 30 minutes. Drain all the water and keep the soaked rice aside.Rinse, peel and chop the vegetables.Crush chopped ginger, garlic and green chillies to a paste in a mortar-pestle or grind them in a small mixer or grinder with a bit of water. Frying spices and sautéing onionsIn a deep thick bottomed pot or pan, heat ghee or oil and fry all the whole spices mentioned above, till the oil becomes fragrant and the spices splutter. Add the onions and saute them till golden. Saute the onions on a low to medium-low heat and stir often for even browning.Add the ginger-garlic-green chili paste and saute for some seconds till their raw aroma goes away. Add the tomatoes and sauté for 2 to 3 minutes on a low to medium-low heat.Add all the chopped veggies, green peas and sauté again for 1 to 2 minutes on a low to medium-low heat.Add rice and sauté gently for 1 to 2 minutes on a low or medium-low heat, so that the rice gets well coated with the oil.Add water and lemon juice. Mix and stir. Season with salt and stir again.Making Vegetable PulaoCover tightly and let the rice cook on a low heat, till the water is absorbed and the rice is well cooked. Check in between a few times to check if the water is enough. Depending on the quality of rice, you may need to add less or more water. With a fork too, you can gently stir the rice without breaking the rice grains.Once the rice grains are cooked, fluff and let the rice stand for 5 minutes.Serve pulao hot with some side salad, sliced onion and lemon wedges or raita. You can also garnish it with chopped coriander or mint leaves or fried cashews or fried onions. ",NutritionCalories: 429kcal | Carbohydrates: 75g | Protein: 9g | Fat: 11g | Saturated Fat: 6g | Polyunsaturated Fat: 1g | Monounsaturated Fat: 3g | Cholesterol: 25mg | Sodium: 68mg | Potassium: 501mg | Fiber: 6g | Sugar: 5g | Vitamin A: 1839IU | Vitamin B1 (Thiamine): 1mg | Vitamin B2 (Riboflavin): 1mg | Vitamin B3 (Niacin): 2mg | Vitamin B6: 1mg | Vitamin C: 32mg | Vitamin E: 1mg | Vitamin K: 11µg | Calcium: 74mg | Vitamin B9 (Folate): 46µg | Iron: 3mg | Magnesium: 51mg | Phosphorus: 149mg | Zinc: 1mg
2,Veg Fried Rice Recipe (Chinese Style),https://www.vegrecipesofindia.com/wp-content/uploads/2013/08/fried-rice-2-280x280.jpg,"This classic Chinese style Veg Fried Rice recipe is loaded with fresh mixed vegetables, aromatics, fragrant spices and seasonings for an incredibly hearty, flavorful and vegan vegetable fried rice.",15minutes,30minutes,45minutes,3,,Main Course,"Chinese, Indo Chinese","Vegan, Vegetarian",For cooking rice▢ 1 cup basmati rice or long grained rice – 190 to 200 grams▢ 4 to 4.5 cups water▢ ½ teaspoon salt or add as required▢ 2 to 3 drops toasted sesame oil or any neutral oil,"Cooking riceRinse rice very well till the water runs clear of starch. Soak rice in water for 30 mins. Drain and keep aside.In a pot, bring water to a gentle boil with salt and 2 to 3 drops of toasted sesame oil.Add the soaked and drained rice to the hot water.On a low to medium to medium-high heat simmer rice without the lid.When rice becomes al dente or just about cooked, remove the pot from the heat. Strain the rice in a colander or sieve. You can also gently rinse cooked rice in water so that they stop cooking and don't stick to each other. Cover the cooked rice and set aside until the rice cools completely. You can even refrigerate rice with a covered lid for 30 minutes. Chopping veggiesWhen the cooked rice is cooling, chop the veggies finely and keep aside. Remember to chop the french beans very finely. They take more time to cook than other veggies. You can also blanch them first and then cook. Another option is to add the beans first and then add the other vegetables.Making veg fried riceHeat oil in a wok or a pan. First add the star anise and fry for a few seconds or until the oil becomes fragrant.Add the garlic, ginger and sauté for some seconds. No need to brown the garlic. Add the spring onions whites and sauté for about 2 minutes.Then add finely chopped french beans. Stir fry french beans for 2 to 3 minutes over medium to medium-high heat.Add the remaining finely chopped veggies, including mushrooms and celery. Increase the heat to a high to thoroughly cook all of the vegetables.You have to continuously toss and stir while frying so that the veggies are uniformly cooked and do not get burnt.The vegetables have to be stir-fried, until they are almost cooked and yet retain their crunchiness and crispiness. Stir-frying vegetables on high heat takes about 4 to 6 minutes. Add the soy sauce, salt and pepper. Stir quickly and add cooked and cooled rice.Stir fry for a few minutes until the sauce has coated the rice well. Keep a check when adding salt, as soy sauce already has salt in it.Serve the veg fried rice hot as it is or with with your favorite Chinese side. Serving suggestionsThough fried rice tastes great on its own, you can pair it with Veg Manchurian, Gobi Manchurian, Chilli Paneer, Spring Rolls or Chilli Mushroom. More side recipes for veg fried rice are linked and listed in the main post. Storing fried riceVegetable fried rice stays good for a day when refrigerated. But I would recommend it to be eaten as soon as you make it since a few days old refrigerated rice is not good for health. ",NutritionCalories: 394kcal | Carbohydrates: 56g | Protein: 8g | Fat: 15g | Saturated Fat: 2g | Sodium: 1815mg | Potassium: 309mg | Fiber: 3g | Sugar: 3g | Vitamin A: 2014IU | Vitamin B1 (Thiamine): 1mg | Vitamin B2 (Riboflavin): 1mg | Vitamin B3 (Niacin): 3mg | Vitamin B6: 1mg | Vitamin C: 17mg | Vitamin D: 1µg | Vitamin E: 1mg | Vitamin K: 37µg | Calcium: 43mg | Vitamin B9 (Folate): 29µg | Iron: 1mg | Magnesium: 33mg | Phosphorus: 129mg | Zinc: 1mg
3,Khichdi Recipe | Easy Moong Dal Khichdi,https://www.vegrecipesofindia.com/wp-content/uploads/2021/02/khichdi-recipe-4-280x280.jpg,"Khichdi recipe is a delicious one pot meal of rice and moong lentils. Moong Dal Khichdi is light and easy to digest healthy food. Stove-top pressure cooker, Instant Pot and Stove-top Pan instructions are included in the recipe card.",30minutes,10minutes,40minutes,2,,Main Course,Indian,"Vegan, Vegetarian","For soaking lentils and rice▢ ½ cup moong dal (split and husked mung lentils)▢ ½ cup rice – you can add any rice, regular short or medium grained rice or even basmati▢ water – as required","Soaking rice and lentilsRinse and wash moong lentils and rice together. Soak both rice and lentils for 30 minutes in water.After 30 minutes, drain all the water and set aside.Sautéing onions, tomatoes, spicesHeat ghee or oil in a 3 litre pressure cooker. Add cumin seeds. When cumin splutters then add onions.Sauté onions until translucent. No need to make onions light brown or golden brown.Once the onions become translucent, then add tomatoes, green chilli and ginger.Mix and add turmeric powder and asafoetida. Mix again and sauté until the tomatoes softens.Add the rice and moong lentils to the pressure cooker.Stir and sauté for a minute. Add water and season with salt.Mix well. Check the taste of the water and it should be slightly salty. Cooking khichdiClose the lid tightly and pressure cook on a high heat for 7 to 8 whistles or 8 to 9 minutes on medium-high to high heat. Switch off heat and wait. Let the pressure fall naturally in the cooker. When there is no pressure in the cooker, remove the lid and check the consistency. If it looks too thick, add some hot water and mix well.Keep on sim or low heat to simmer for a few minutes until you get the right consistency.The consistency can be adjusted as per your choice by adding less or more water. Some people prefer thick and some thin consistency.While serving drizzle 1 to 2 teaspoons of ghee on top while serving. Optional step.Serve moong dal khichdi hot or warm with curd (yogurt) and accompanying salad.Instant Pot Khichdi RecipeFollow the steps below to make this savory and comforting rice & lentil dish in a 6 quart Instant Pot.Press the sauté function of your IP. Let the display read 'hot'. Add ghee or oil. Fry cumin seeds until they splutter.Add onions and sauté until they soften. Tip in the tomatoes, ginger, green chillies and sauté stirring often until tomatoes soften. Stir in the turmeric powder and asafoetida.Add soaked rice and lentils. Stir deglazing if needed.  Pour 3.5 cups water and salt. Deglaze removing any stuck ingredients from the bottom of the pan. Seal with the IP lid and set the valve to the sealing position. Pressure cook on high pressure for 9 minutes. When you hear the beep sound, wait for 10 minutes and then do a quick pressure release lifting the valve carefully.Check the consistency. If it is too thick, add some hot water and sauté for 1 to 2 minutes using the sauté function. If it has a thin consistency, sauté for some more minutes until you get the desired consistency. Serve hot or warm. Khichdi in a pan on the stove-topTo make khichdi in a pan, follow all the directions as listed for the pressure cooker version in a pan until you add the rice and lentils.After you add the rice and lentils, give a good stir and sauté for a minute. Add 4 to 4.5 cups water and season with salt. Cover the pan and cook on a medium-low to medium flame until the lentils are softened and mushy. Keep a check while cooking and if the water has dried up with undercooked lentils, add some hot water and combine well. Cover and continue to cook. When the khichri is cooked, check the consistency. If thick, add some hot water and simmer for 1 to 2 minutes. For a thin consistency, continue too cook for some more minutes. Serving suggestionsThe sides that that pair great and make khichdi a satisfying complete meal are Curd (yogurt), Papad (roasted or fried), Pickle and Ghee – a teaspoon or two drizzled on top of the khichdiYou can also serve it with any raita or salad. I like to to enjoy khichdi drizzled with some lemon juice and served with your choice of vegetable fries and with vegetable salad.Storage and LeftoversI always prefer to eat and serve khichdi fresh as it can become dry and lumpy on cooling or after some hours. If you do end up with leftovers, you can store in the refrigerator in an air-tight container for up to 1 day.I also prefer to reheat the dish in a saucepan instead of the oven so that I can add some water to thin it a bit and ensure everything is evenly heated before serving.On cooling khichdi does thicken and becomes lumpy, so you have to add some water to it while reheating.",NutritionCalories: 482kcal | Carbohydrates: 73g | Protein: 17g | Fat: 14g | Saturated Fat: 8g | Polyunsaturated Fat: 1g | Monounsaturated Fat: 4g | Cholesterol: 33mg | Sodium: 632mg | Potassium: 177mg | Fiber: 7g | Sugar: 3g | Vitamin A: 326IU | Vitamin B1 (Thiamine): 1mg | Vitamin B2 (Riboflavin): 1mg | Vitamin B3 (Niacin): 1mg | Vitamin B6: 1mg | Vitamin C: 6mg | Vitamin E: 1mg | Vitamin K: 2µg | Calcium: 65mg | Vitamin B9 (Folate): 13µg | Iron: 3mg | Magnesium: 25mg | Phosphorus: 72mg | Zinc: 1mg
4,Bisi Bele Bath Recipe (Karnataka Style),https://www.vegrecipesofindia.com/wp-content/uploads/2025/07/bisi-bele-bath-recipe-1-280x280.jpg,"Bisi Bele Bath is a delicious and wholesome one-pot meal from Karnataka, made with rice, toor dal (pigeon pea lentils), mixed vegetables, tamarind, and a special spice blend. This hearty dish is finished with a flavorful tempering of mustard seeds, curry leaves, dried red chilies, asafoetida, and ghee. Slightly tangy, aromatic, and comforting, it's best served hot with a drizzle of ghee and crispy papad or chips on the side.",1hour,20minutes,1hour,6,,Main Course,"Karnataka, South Indian",Vegetarian,"For cooking rice▢ 1 cup rice (I used sona masuri rice)▢ ¼ cup peanuts – raw▢ ¼ teaspoon rock salt (edible and food grade) or regular salt, add as required▢ 2.5 cups water  – for cooking the rice in a pan","Cooking riceRinse the rice and peanuts a couple of times in water. Take them in a pan and pour 2.5 cups water over them.Soak both rice and peanuts for 20 to 25 mins. Later add the salt.Keep the pan the stovetop and cook the rice on medium to medium-high heat.If required, then you can add some more water while cooking the rice.Bring to a boil and then lower the heat. Simmer till the rice grains are tender and cooked well and all the water has been absorbed. The peanuts would also cook well. Cover and set aside.Cooking lentils and veggiesSoak 1 tablespoon tightly packed tamarind in ½ or ⅔ cup warm water for 25 to 30 mins.Later squeeze and extract the tamarind pulp in the soaked water. Strain and set aside.In a pressure cooker, add rinsed tur dal, turmeric powder and 2 to 2.5 cups water.Pressure cook for 8 to 9 whistles on medium heat or until the dal is cooked soft and mushy.Once the pressure drops on its own in the cooker, then only open the lid. Mash the dal with a spoon and set aside.In another pan, take all the chopped veggies and ¼ teaspoon salt. Pour 2 cups water and stir to combine.Cover and allow the veggies to cook till they are fork tender but still retain their shape.Making bisi bele bathNow in the cooker containing the mashed dal, add the cooked rice and peanuts.Then add the cooked vegetables along with its stock. Stir lightly to mix.Add 1 cup water. Add the prepared tamarind pulp. Mix everything well taking care the rice grains do not break.Now in another pan or bowl, take the 3 tablespoons of the bisi bele bath masala and 1 cup water.Stir to mix very well. The masala tends to stick to the back of the spoon while stirring, so scrape it off and add to the mixture.Now add this bisi bele bath powder and water mixture in the cooker.Add desiccated coconut. Add 1 teaspoon salt or as required. Stir and mix.Keep the cooker without the lid on the stove top and simmer on a low heat for about 15 to 20 mins. Add more water if required.Keep on stirring often. The raw aroma of the tamarind has to go away and all the flavors should be blended well. Cover and set aside once done.TemperingIn a another pan or the tadka (tempering) pan, heat ghee or oil first. Crackle the mustard seeds first. Keep heat to a low or medium-low.Add the curry leaves, marathi moggu, dry red chilies, cashews and asafoetida.Fry until the dry red chilies change color and the cashews turn a light golden. Don't burn the spices.Pour this tempering in the prepared bisi bele bath. Stir to mix and cover the cooker with its lid for about 5 mins, so that the tempering flavors infuse in the bisi bele bath.Serve bisi bele bath with potato wafers or banana chips/wafers or fried or roasted papads. While serving you can top with some ghee if you prefer.",NutritionCalories: 389kcal | Carbohydrates: 55g | Protein: 12g | Fat: 15g | Saturated Fat: 7g | Polyunsaturated Fat: 2g | Monounsaturated Fat: 5g | Cholesterol: 19mg | Sodium: 630mg | Potassium: 571mg | Fiber: 10g | Sugar: 9g | Vitamin A: 2223IU | Vitamin B1 (Thiamine): 0.2mg | Vitamin B2 (Riboflavin): 0.1mg | Vitamin B3 (Niacin): 26mg | Vitamin B6: 0.3mg | Vitamin C: 54mg | Vitamin E: 1mg | Vitamin K: 19µg | Calcium: 75mg | Vitamin B9 (Folate): 293µg | Iron: 2mg | Magnesium: 71mg | Phosphorus: 156mg | Zinc: 1mg
